{"title":"Nexus Core Kit","order":50,"icon":"minecraft:ender_eye","deliveryTicks":240,"requirements":[{"category":"echologisticsnetwork:machine_parts","count":4},{"category":"echologisticsnetwork:blackbox_parts","count":1},{"category":"echologisticsnetwork:medicine","count":2}],"targetBlockTypes":["echologisticsnetwork:loadout_locker","echologisticsnetwork:supply_crate","echologisticsnetwork:route_requester","echologisticsnetwork:auto_restock_station"]}
